<?xml version="1.0" encoding="utf-8"?>
<!--Vascular Network Model: graph description-->
<NetworkGraph id="1" version="3.0"
xmlns:xsi="http://www.w3.org/2001/XMLSchema-instance"
xsi:noNamespaceSchemaLocation="vascular_network_v3.2.xsd">
    <case>
        <patient_id>00000</patient_id>
        <visit>other</visit>
    </case>
<nodes>
    <node type="inflow" id="1" name="heart"/>
    <node id="2"/>
    <node id="3"/>
    <node id="4"/>
    <node id="5"/>
    <node type="downstream network" id="6" name="wk_intercostals">
        <properties>
            <windkessel>
                <expression>$WindkesselRel[wk_intercostals] = (($mean_pressure[])/(0.07*$cardiac_output[]))*(133.3223684211*6.0e7)</expression>
            </windkessel>
        </properties>
    </node>
    <node id="7"/>
    <node id="8"/>
    <node type="downstream network" id="9" name="wk_celiac">
        <properties>
            <windkessel>
                <expression>$WindkesselRel[wk_celiac] = (($mean_pressure[])/(0.13*$cardiac_output[]))*(133.3223684211*6.0e7)</expression>
            </windkessel>
        </properties>
    </node>
    <node id="10"/>
    <node type="downstream network" id="11" name="wk_right_renal">
        <properties>
            <windkessel>
                <expression>$WindkesselRel[wk_right_renal] = (($mean_pressure[])/(0.11*$cardiac_output[]))*(133.3223684211*6.0e7)</expression>
            </windkessel>
        </properties>
    </node>
    <node id="12"/>
    <node type="downstream network" id="13" name="wk_left_renal">
        <properties>
            <windkessel>
                <expression>$WindkesselRel[wk_left_renal] = (($mean_pressure[])/(0.11*$cardiac_output[]))*(133.3223684211*6.0e7)</expression>
            </windkessel>
        </properties>
    </node>
    <node id="14"/>
    <node type="downstream network" id="15" name="wk_sup_mesenteric">
        <properties>
            <windkessel>
                <expression>$WindkesselRel[wk_sup_mesenteric] = (($mean_pressure[])/(0.1715*$cardiac_output[]))*(133.3223684211*6.0e7)</expression>
            </windkessel>
        </properties>
    </node>
    <node id="16"/>
    <node type="downstream network" id="17" name="wk_inf_mesenteric">
        <properties>
            <windkessel>
                <expression>$WindkesselRel[wk_inf_mesenteric] = (($mean_pressure[])/(0.0085*$cardiac_output[]))*(133.3223684211*6.0e7)</expression>
            </windkessel>
        </properties>
    </node>
    <node id="18"/>
    <node id="19"/>
    <node type="downstream network" id="20" name="wk_right_ext_iliac">
        <properties>
            <windkessel>
                <expression>$WindkesselRel[wk_right_ext_iliac] = (($mean_pressure[])/(0.07*$cardiac_output[]))*(133.3223684211*6.0e7)</expression>
            </windkessel>
        </properties>
    </node>
    <node type="downstream network" id="21" name="wk_right_int_iliac">
        <properties>
            <windkessel>
                <expression>$WindkesselRel[wk_right_int_iliac] = (($mean_pressure[])/(0.03*$cardiac_output[]))*(133.3223684211*6.0e7)</expression>
            </windkessel>
        </properties>
    </node>
    <node id="22"/>
    <node type="downstream network" id="23" name="wk_left_ext_iliac">
        <properties>
            <windkessel>
                <expression>$WindkesselRel[wk_left_ext_iliac] = (($mean_pressure[])/(0.07*$cardiac_output[]))*(133.3223684211*6.0e7)</expression>
            </windkessel>
        </properties>
    </node>
    <node type="downstream network" id="24" name="wk_left_int_iliac">
        <properties>
            <windkessel>
                <expression>$WindkesselRel[wk_left_int_iliac] = (($mean_pressure[])/(0.03*$cardiac_output[]))*(133.3223684211*6.0e7)</expression>
            </windkessel>
        </properties>
    </node>
    <node id="25"/>
    <node id="26"/>
    <node type="downstream network" id="27" name="wk_right_radial_distal">
        <properties>
            <windkessel>
                <expression>$WindkesselRel[wk_right_radial_distal] = (($mean_pressure[])/(0.0074*$cardiac_output[]))*(133.3223684211*6.0e7)</expression>
            </windkessel>
        </properties>
    </node>
    <node id="28"/>
    <node type="downstream network" id="29" name="wk_right_interosseous">
        <properties>
            <windkessel>
                <expression>$WindkesselRel[wk_right_interosseous] = (($mean_pressure[])/(0.0019*$cardiac_output[]))*(133.3223684211*6.0e7)</expression>
            </windkessel>
        </properties>
    </node>
    <node type="downstream network" id="30" name="wk_right_ulnar_distal">
        <properties>
            <windkessel>
                <expression>$WindkesselRel[wk_right_ulnar_distal] = (($mean_pressure[])/(0.0157*$cardiac_output[]))*(133.3223684211*6.0e7)</expression>
            </windkessel>
        </properties>
    </node>
    <node id="31"/>
    <node id="32"/>
    <node id="33"/>
    <node type="downstream network" id="34" name="wk_left_radial_distal">
        <properties>
            <windkessel>
                <expression>$WindkesselRel[wk_left_radial_distal] = (($mean_pressure[])/(0.0074*$cardiac_output[]))*(133.3223684211*6.0e7)</expression>
            </windkessel>
        </properties>
    </node>
    <node id="35"/>
    <node type="downstream network" id="36" name="wk_left_interosseous">
        <properties>
            <windkessel>
                <expression>$WindkesselRel[wk_left_interosseous] = (($mean_pressure[])/(0.0019*$cardiac_output[]))*(133.3223684211*6.0e7)</expression>
            </windkessel>
        </properties>
    </node>
    <node type="downstream network" id="37" name="wk_left_ulnar_distal">
        <properties>
            <windkessel>
                <expression>$WindkesselRel[wk_left_ulnar_distal] = (($mean_pressure[])/(0.0157*$cardiac_output[]))*(133.3223684211*6.0e7)</expression>
            </windkessel>
        </properties>
    </node>
    <node id="38"/>
    <node type="downstream network" id="39" name="wk_right_ext_carotid">
        <properties>
            <windkessel>
                <expression>$WindkesselRel[wk_right_ext_carotid] = (($mean_pressure[])/(0.00675*$cardiac_output[]))*(133.3223684211*6.0e7)</expression>
            </windkessel>
        </properties>
    </node>
    <node id="40"/>
    <node id="41"/>
    <node type="downstream network" id="42" name="wk_left_ext_carotid">
        <properties>
            <windkessel>
                <expression>$WindkesselRel[wk_left_ext_carotid] = (($mean_pressure[])/(0.00675*$cardiac_output[]))*(133.3223684211*6.0e7)</expression>
            </windkessel>
        </properties>
    </node>
    <node id="43"/>
    <node id="44"/>
    <node id="45"/>
    <node id="46"/>
    <node id="47"/>
    <node type="downstream network" id="48" name="wk_right_pca_p2">
        <properties>
            <windkessel>
                <expression>$WindkesselRel[wk_right_pca_p2] = (($mean_pressure[])/(0.0137*$cardiac_output[]))*(133.3223684211*6.0e7)</expression>
            </windkessel>
        </properties>
    </node>
    <node type="downstream network" id="49" name="wk_left_pca_p2">
        <properties>
            <windkessel>
                <expression>$WindkesselRel[wk_left_pca_p2] = (($mean_pressure[])/(0.0137*$cardiac_output[]))*(133.3223684211*6.0e7)</expression>
            </windkessel>
        </properties>
    </node>
    <node id="50"/>
    <node type="downstream network" id="51" name="wk_right_mca">
        <properties>
            <windkessel>
                <expression>$WindkesselRel[wk_right_mca] = (($mean_pressure[])/(0.0345*$cardiac_output[]))*(133.3223684211*6.0e7)</expression>
            </windkessel>
        </properties>
    </node>
    <node id="52"/>
    <node type="downstream network" id="53" name="wk_left_mca">
        <properties>
            <windkessel>
                <expression>$WindkesselRel[wk_left_mca] = (($mean_pressure[])/(0.0345*$cardiac_output[]))*(133.3223684211*6.0e7)</expression>
            </windkessel>
        </properties>
    </node>
    <node id="54"/>
    <node id="55"/>
    <node type="downstream network" id="56" name="wk_right_aca_a2">
        <properties>
            <windkessel>
                <expression>$WindkesselRel[wk_right_aca_a2] = (($mean_pressure[])/(0.0205*$cardiac_output[]))*(133.3223684211*6.0e7)</expression>
            </windkessel>
        </properties>
    </node>
    <node type="downstream network" id="57" name="wk_left_aca_a2">
        <properties>
            <windkessel>
                <expression>$WindkesselRel[wk_left_aca_a2] = (($mean_pressure[])/(0.0205*$cardiac_output[]))*(133.3223684211*6.0e7)</expression>
            </windkessel>
        </properties>
    </node>
</nodes>
    <superedges>
        <superedge id="1" name="body">
            <superedges>
                <superedge id="2" name="ascending_aorta">
                    <edgesIds>
                        <edgeIds edge_id="1"/>
                        <edgeIds edge_id="2"/>
                        <edgeIds edge_id="3"/>
                        <edgeIds edge_id="4"/>
                        <edgeIds edge_id="5"/>
                    </edgesIds>
                </superedge>
                <superedge id="3" name="descending_aorta">
                    <edgesIds>
                        <edgeIds edge_id="6"/>
                        <edgeIds edge_id="7"/>
                        <edgeIds edge_id="8"/>
                        <edgeIds edge_id="9"/>
                        <edgeIds edge_id="10"/>
                        <edgeIds edge_id="11"/>
                        <edgeIds edge_id="12"/>
                        <edgeIds edge_id="13"/>
                        <edgeIds edge_id="14"/>
                        <edgeIds edge_id="15"/>
                        <edgeIds edge_id="16"/>
                        <edgeIds edge_id="17"/>
                    </edgesIds>
                </superedge>